,id,date,time,username,name,tweet,Valor,replies_count,retweets_count,likes_count
1542,1.38E+18,4/20/2021,22:32:15,anagdbapv,DiosSiemprePuedeM√°s.,"@Franco50641733 @DiarioTalCual En el mundo, el virus chino. Pero el problema no es otro pa√≠s para el venezolano, el problema st√° en Venezuela, los criminales de lesa humanidad, violadores de DDHH y c√≥mplices st√°n en Venezuela, responsable de la migrac",-0.5,0,0,1
1543,1.38E+18,4/20/2021,22:18:12,estaywalker,Mauricio Estayüíöüá®üá±,@biobio @ChileONU porque no se ocupan de  @NicolasMaduro y su dictadura para detener la migraci√≥n desde Venezuela ? #NoMasONU,-0.5,0,0,0
1544,1.38E+18,4/20/2021,21:45:23,lictuslictus,Gabriel,"Lo √∫nico por lo que ser√° recordado en un libro de historia @ppkamigo fue por haber tra√≠do la migraci√≥n venezolana e indultado a Fujimori. De ah√≠ no se ninguna obra p√∫blica, es lamentable que tanto equipo de lujo para NADA. Gracias a ti @KeikoFujimori",0,0,0,1
1545,1.38E+18,4/20/2021,21:33:38,magallego58,marino ramirez,"@marioherzam Completamente de acuerdo y derrotamos el comunismo y as√≠ evitamos  expropiaciones,  migraci√≥n de empresarios hacia otros pa√≠ses y una narcodictadura peor que Venezuela.",-0.5,0,1,3
1546,1.38E+18,4/20/2021,21:30:39,luzsarela,Sarela Orihuela,"@GretelHuapaya @jose_edg @patriciov La migracion venezolana trajo mas pobreza al Per√∫, el pa√≠s tiene q vacunarlos, darles salud, educaci√≥n porq van a las escuelas publicas, ojo con eso no quiero decir q tengo xenofobia, no es facil dejar todo en tu pai",0,1,0,0
1547,1.38E+18,4/20/2021,21:00:08,fredigm3,Alessandro ‚úåüçÄ,"@KeikoFujimori Si con esa firmeza hubiera encarado la migraci√≥n Venezolana a sus 73 congresistas, fuera! Fingida",-0.5,0,1,3
1548,1.38E+18,4/20/2021,20:00:08,johannamndez18,Johanna M√©ndez,@escovargabriela Por lo menos no dir√°n que su pa√≠s se volvi√≥ üí©üí©üí©üí©üí© por culpa de la migraci√≥n venezolana. Ellos s√≥litos eligieron vivir en Sucialismo.,-0.5,0,0,0
1549,1.38E+18,4/20/2021,19:38:10,sorayajperez,Soraya P√©rez,"#CaminoAlaCumbre #MaduroManchaLaCumbre Rechazamos la invitaci√≥n de Nicol√°s Maduro a la @CumbreIberoA Es darle la espalda al pueblo de Venezuela e insultar a las v√≠ctimas de violaciones de #DDHH y a quienes resisten en Vzla, como a los millones de venezolanos en migracion forzosa.",-0.5,0,3,3
1550,1.38E+18,4/20/2021,19:08:41,14ejsr,Todo es posible!!!üëäüëä,@canalN_ Si el socialismo  cubano  llega a peru estar√°n peor que Hait√≠ y regresaran a los viejos tiempos de migraci√≥n masiva.  El socialismo de Cuba destruy√≥ a la naci√≥n m√°s Rica en minerales del planeta  Venezuela. Imaginen como va quedar Peru.,0,8,4,20
1551,1.38E+18,4/20/2021,17:54:37,paezreconcilia,P√°ezT√°cticoTemplario.¬∑.,"@juanrallo Venezuela ...  Despu√©s de 1958 ... Cay√≥ en el populismo ! .. Los pol√≠ticos SE  dedicaron a .. Importar votos, tra√≠dos  por una migraci√≥n sin educaci√≥n de ning√∫n tipo !  Llenaron las ciudades con ""cinturones"" de miseria y manipulaci√≥n ! ",-1,1,0,1
1552,1.38E+18,4/20/2021,17:48:15,cointacoromoto,ROSAMYSTICA,@lrjuridico1 @kannabius @escovargabriela A Venezuela no vendr√°n. Y los pa√≠ses vecinos no son muy prosperos que se diga.  As√≠ si van a entender la migraci√≥n venezolana.,-0.25,0,0,0
1553,1.38E+18,4/20/2021,17:24:12,nario33744432,Nari√±o,"@WRadioColombia Se√±or Julio,mis respetos,hoy estuve preso en Venezuela por no tener cedula venezolana,me suele pasar esto cada vez q la policia me pide documentos,migraci√≥n venezolana me quito el pasaporte y la cedula colombiana,estoy inscrito en la uni",-0.75,0,0,0
1554,1.38E+18,4/20/2021,16:53:55,raulromero2000,Raul Romero,"@luisddat @Vincent43417344 @e_d_x_ @larepublica_pe Yo no quiero ser Venezuela, tienen un problema de migraci√≥n y pobreza . Que ha sido catalagodo como cat√°strofe. Tiene raz√≥n no hay pero ciego quien no quiere ver.",-0.5,1,0,0
1555,1.38E+18,4/20/2021,16:52:28,ejdecena,·¥á·¥Ö…¢·¥Ä Ä·¥Ö ·¥Ö·¥á·¥Ñ·¥á…¥·¥Ä ‚ùÅ,"El peor gobierno de la historia de Venezuela ha provocado la mayor crisis econ√≥mica de la historia de Venezuela, junto con la mayor migraci√≥n de venezolanos y el peor deterioro institucional de la historia del pa√≠s.",-1,13,79,99
1556,1.38E+18,4/20/2021,16:40:16,nnoemipc,N Noemi Paucar,"@Jali_Cotrina Con solo mira alrededor de los pa√≠ses para darse cuenta de la migraci√≥n de venezolanos, es por que Venezuela est√° con una inflaci√≥n descomunal, vean las noticias, el burro no quiere comprar vacunas para tenernos sometidos y quiz√°s hasta",-0.75,0,0,0
1557,1.38E+18,4/20/2021,16:37:56,eduardo50578520,eduardo rodriguez,"@JoelGon93362862 @elcomerciocom @rgrvelez eso dile al patojo q nunca puso politicas fuertes para frenar la migracion ilegal, porq no reforzaron la frontera como hizo peru? claro se quejan de los venecos pero bien q los usaron en su sucia campa√±a jaja ""la",-0.5,0,0,2
1558,1.38E+18,4/20/2021,16:24:04,clavierguzman52,JLCLAVIERGUZMAN,@Jali_Cotrina El caso de Venezuela si alg√∫n Pa√≠s lo ha palpado con la migraci√≥n es El Per√∫ !! Solo una pregunta sencilla: Por qu√© decidiste salir de Venezuela?,-0.25,0,2,1
1559,1.38E+18,4/20/2021,16:07:13,josetorohardy,Jose Toro Hardy,"El peor gobierno de la historia de Venezuela ha provocado la mayor crisis econ√≥mica de la historia de Venezuela, junto con la mayor migraci√≥n de venezolanos y el peor deterioro institucional de la historia del pa√≠s",-1,118,1526,2957
1560,1.38E+18,4/20/2021,15:54:08,leono39,Alf,"@PKSConsultores Maduro pues. Para mi es claro y evidente, el llanero nos ha invadido sin disparar una sola bala, 2' millones    +/-,  de venecos aqu√≠ metidos con el cuento de migraci√≥n humanitaria. Seremos un sat√©lite de Venezuela y Cuba. La pregunta e",0,0,0,1
1561,1.38E+18,4/20/2021,14:42:29,jefferson_diaz,Jefferson Diaz :.,"HILO üßµcon algunos n√∫meros sobre la migraci√≥n venezolana en Ecuador, que heredar√° el presidente electo @LassoGuillermo a partir del 24 de mayo.   #migraci√≥n #Refugiados #migraci√≥nvenezolana #migrantesvenezolanos #venezolanosenecuador",0,1,1,1
1562,1.38E+18,4/20/2021,14:06:18,teodostres,teo,"@NituPerez La migracion descontrolada es espada de destruccion de una nacion. Y el migrante nunca va a dar va a buscar y debe agradecer. no quiere decir eso que deba ser maltratado, pero debe aprender a respetar ell pais acogedor. En Vene Muchos migrantes",-0.25,0,1,2
1563,1.38E+18,4/20/2021,13:14:24,equilibrium_cd,Equilibrium - Centro para el Desarrollo Econ√≥mico,"#WebtalkCenDE  Migraci√≥n calificada en contextos de desplazamiento. Avances y retos para el ejercicio de la profesi√≥n de la poblaci√≥n venezolana en el üáµüá™.  üë•Contaremos con la participaci√≥n de @FelineFreier, @martaluzes, @Gbrauckmeyer y @martacastrou.  üóìÔ∏èJue 22/04 üïï6:00 p.m",0,0,2,3
1564,1.38E+18,4/20/2021,12:55:05,alberto64203345,Alberto Garc√≠a,"@yllari_maryell @TitoWanka Esa no es una falla del sistema, es una pendejada de ese empresario hdp que busca hacer riqueza a costa del trabajador. Cambiar al socialismo no solucionar√° tu problema. Si el socialismo fuese la soluci√≥n, no tendr√≠amos migra",-0.75,3,0,4
1565,1.38E+18,4/20/2021,12:34:22,hablandocla,Hablando Claro!!!,"@Dona_Pily2 @IvanDuque @MinHacienda Reducir el gasto publico, salarios congresistas, mikes de secretarias y dependencias obsoletas y revisar de fondo la responsabilidad que asumimos todos los colombianos frente a la migracion venezolana, eso nos ha costad",0,0,1,1
1566,1.38E+18,4/20/2021,12:01:06,venezuelahoy_,VenezuelaHoy,El Carabobe√±o: Iv√°n Duque prev√© llevar el tema de la migraci√≥n venezolana a la Cumbre Iberoamericana,0.25,0,0,0
1567,1.38E+18,4/20/2021,11:33:59,surprimavera,Primavera Del Sur,"@DeisyCastaeda2 @JosFari51554066 M√°s migraci√≥n hay en Colombia ...6 millones en Venezuela, 4 millones en Espa√±a, 2 millones en EEUU, y otros cuentos de miles en otros pa√≠ses... Panam√°, Chile etc. Por cierto la mayor√≠a de los venezolanos que emigran ",-0.5,0,4,4
1568,1.38E+18,4/20/2021,11:08:02,joespqr,Jorge Aray,"He le√≠do con mucha preocupaci√≥n varios casos de ""profesores"" que violan la √©tica docente al opinar, consultar o juzgar a sus estudiantes... Definitivamente la migraci√≥n ha da√±ado m√°s de lo que nos imaginamos a Venezuela",-0.5,1,0,5
1569,1.38E+18,4/20/2021,10:59:58,fmdc17,FDCT,"@mpj1952 Porque la √∫nica soluci√≥n a la situaci√≥n en Venezuela es v¬°olenta, pocos est√°n dispuestos a participar y ning√∫n pa√≠s se va a solidarizar ni va a participar, la migraci√≥n venezolana es un negocio para esos pa√≠ses, prefieren arreglar su est",-0.25,0,0,0
1570,1.38E+18,4/20/2021,10:44:31,maurozerpa7,Mauro Zerpa,@TarekSaidVzla D√≠game Es Mentira Los Representantes de La Oposici√≥n Han  Recibido aportes Econ√≥micos de Otras Naciones para Ayudar a La Migraci√≥n Venezolana cuando d√≥nde como se a Visto esa ayuda sobre todo en estos tiempos de Pandemia,-0.25,0,0,1
1571,1.38E+18,4/20/2021,10:40:07,jmming,Cristian Grande,@RomeroDodany @prensagrafica Tu respuesta seria valida si la migracion masiva hubiera comenzado desde que llego Nayib... Como en el caso de Venezuela... Donde antes que maduro tomara el poder la gente migraba a Venezuela y luego del 2014 la gente no queri,-0.25,1,0,0
1572,1.38E+18,4/20/2021,10:31:12,lauracamila_cc,Laura Cristancho,@TheStagHunt Hola @TheStagHunt Soy periodista del Proyecto Migraci√≥n Venezuela y quiero hacerte un par de preguntas sobre este tema ¬øc√≥mo puedo contactarte?,0,0,0,0
1573,1.38E+18,4/20/2021,9:56:15,docentesactivos,Educaci√≥n Primero,"Ellos podr√°n decir las mentiras que quieran, podr√°n tener el control medi√°tico en Venezuela y medios internacionales pagados con dinero de sangre; pero la migraci√≥n habla por s√≠ sola: Gente huyendo del genocidio. Elecciones generales, libres, justas y con verificaci√≥n Inter. ¬°Ya!",-0.5,0,2,3
1574,1.38E+18,4/20/2021,9:17:24,jortantra,Jorge Luis,@elcomercio_peru @ensustrece la derecha tiene a su favor el trauma del terrorismo y el mal ejemplo de Venezuela patente en la migraci√≥n. Y la izquierda tiene la ventaja de un extremo abandono del Estado y de que la pandemia en Per√∫ es la m√°s mortal que,0,0,0,0
1575,1.38E+18,4/20/2021,8:44:23,evanava11926222,Eva Navarro,"Hoy sali√≥ en publicaci√≥n oficial la nueva ley de Migraci√≥n en Chile. Ahora a la espera del reglamento. Esperemos que esto de orden, justicia, equidad, igualdad y humanidad. #Migracion #Venezuela #Chile",0,0,1,0
1576,1.38E+18,4/20/2021,8:39:59,yannbasset,Yann Basset,"hip√≥tesis: es una reacci√≥n de reafirmaci√≥n identitaria en relaci√≥n a la migraci√≥n venezolana, pero al mismo tiempo son los venezolanos que m√°s lo usan como se√±al de integraci√≥n.",0,6,1,18
1577,1.38E+18,4/20/2021,8:39:48,kaosjimenez,se√±orX,"@AurimarCadena @ReportSeguridad @ELTIEMPO La l√≥gica es pracmatica,   digamos el ahumento tan impresionante de desempleo e inseguridad a 2 meses de el inicio de la migraci√≥n venezolana    L√≥gicamente hasta el mas burro se da de cuenta quienes son los qu",-0.25,0,0,0
1578,1.38E+18,4/20/2021,8:34:02,consue047,MARIA CONSUELO SAENZ,@MigracionCol Me gustar√≠a saber c√≥mo colombiana y con mis derechos de ciudadana qu√© hacen con los venezolanos que encuentran robando o que han asesinado hay un ladron reincidente 27 veces porque no est√° en territorio venezolano? por qu√© migraci√≥n no,-0.5,0,0,0
1579,1.38E+18,4/20/2021,8:13:48,levgiro1,Dextr√≥giro,"@Mippcivzla Quien dir√≠a que 200 a√±os despu√©s, Venezuela estar√≠a masacrada por una narco dictadura , condenada al hambre y a la migraci√≥n forzosa.",-0.75,0,0,0
1580,1.38E+18,4/20/2021,5:40:56,aocdmx,Armando,"@FreddyBernal Que verguenza con el padre de la patria a ver como han da√±anado al pais, ver la mayor migracion de Venezolano en toda la historia.... no sigan nombrando su nombre es blasfemia",-0.5,0,0,0
1581,1.38E+18,4/20/2021,5:19:45,edithdg2002,edith lacruz,"@VillegasPoljak Ernesto, la transculturizaci√≥n que el pueblo venezolano ha sufrido en los pueblos cercanos a la frontera con Colombia es grave y en otras ciudades producto de la migraci√≥n de 6 millones de Colombianos, lo del Vallenato esta fuerte, ya en",-0.25,0,0,0
1582,1.38E+18,4/20/2021,5:01:49,nestore00666118,Nestor Enrique,"@gildatrkovic @rlopezaliaga1 Excelente, no se trata de resentimientos personales sino del futuro de nuestro pais por muchas d√©cadas, as√≠ es el comunismo, se hacen del poder casi perpetuamente como lo es en Cuba y Venezuela llev√°ndoles a una pobreza que",-0.25,0,5,8
1583,1.38E+18,4/20/2021,1:04:32,gina_pau,Gina üíô,"@GuilloGil_ S√≠, ninguno ha logrado eso y el que est√° ahora menos!!! Piensa esto, hacia d√≥nde es la migraci√≥n? A Venezuela? A Cuba? No, es al pa√≠s capitalista que a√∫n en condiciones de migrante, le da m√°s de lo que puede obtener en su pa√≠s.",-0.75,1,0,0
1584,1.38E+18,4/19/2021,23:30:36,fhertv1,Fernando Torres Vergara,"@LaTele_Letal Candidato Romero, Que opini√≥n le merece  * 4*1000 * Ley Habeas Data * Informalidad Ascendente  * Migraci√≥n Venezolana * Incremento cultivos de coca * Ascendente delincuencia y hurto  * Ley Anticorrupci√≥n",0,0,0,0
1585,1.38E+18,4/19/2021,23:24:01,sagittaire3,SAGITTAIRE,@EnterateCali el gobierno nacional apoya la migraci√≥n venezolana por altruismo porque quiere ayudar a los venezolanos? aterricemos lo hacen por puro inter√©s por las ayudas internacionales y porque √©stos les sirve de justificacion,-0.75,1,0,2
1586,1.38E+18,4/19/2021,23:07:19,aurimarcadena,Aurimar Cadena,"@kaosjimenez @ReportSeguridad @ELTIEMPO Puras pendejadas es lo que dice este tipo, en pocas palabras el crimen se invent√≥ en Venezuela seg√∫n tu argumento jajaja digamos que en este momento por la migraci√≥n masiva de venezolanos somos los que tenemos el",0,4,0,0
1587,1.38E+18,4/19/2021,22:21:46,adit_cta_ofic,Adit,"@WendyDaniela_8 @InacVzla Hola buenas noches. No. No es obligatorio realizarse la prueba pcr para salir de Venezuela. Lo que debes verificar es si el pa√≠s, en el que har√°s escala (porque no hay vuelos directos) te la solicita. Generalmente, si vas en tr",0,1,0,0
1588,1.38E+18,4/19/2021,22:19:15,ariamoramos,Omaira R,"@JackyMc10 Receta chavista! Qu√© triste que Per√∫ repita la historia de Venezuela, justamente ustedes que est√°n viviendo el impacto de la migraci√≥n de miles de compatriotas que huyen buscando, en su mayor√≠a, una mejor calidad de vida! Ojal√° sigan el e",0.5,0,1,1
1589,1.38E+18,4/19/2021,22:07:25,gdecorso60,GDC,"@Luacc21 As√≠ es, suma  la  cantidad q  naci√≥ en Colombia pero la partida de nacimiento se la otorgaron en Venezuela se presentaban con testigos y una partera y listo es un total desorden la migraci√≥n colombiana es= a problema : social , identidad , eco",0,2,0,0
1590,1.38E+18,4/19/2021,21:19:18,deisycastaeda2,Deisy Casta√±eda,@JosFari51554066 No soy venezolana y pregunto por verdadero inter√©s en su rta. ¬øQu√© es bueno hoy del modelo de gobierno de Maduro y la forma que administra el pa√≠s? ¬ø Por qu√© hay tanta migraci√≥n de sus connacionales?,0,25,0,1
1591,1.38E+18,4/19/2021,21:02:08,julianlopez__,Jules,"ufff la migraci√≥n si se aprueba esa reforma, va a ser muy hp, polombia ahora venezuela, pero en realidad esto es -Latinoam√©rica-",-0.25,0,0,0
1592,1.38E+18,4/19/2021,20:58:21,jruizabogadove,Jhoan Ruiz - Abogado,"Hace unos d√≠as, se conoci√≥ que detuvieron en Colombia, al beisbolista venezolano, Elvis Araujo, por viajar con pasaporte falso. Seg√∫n  Migraci√≥n Colombia, Araujo pretendia viajar a M√©xico, la detenci√≥n se llev√≥ a cabo en el Aeropuerto Internacional ¬´El Dorado¬ª, en Bogot√°.",0,0,0,0
1593,1.38E+18,4/19/2021,20:41:50,kaosjimenez,se√±orX,@AurimarCadena @ReportSeguridad @ELTIEMPO Lo de siempre dicen q vienen a trabajar y estudiar etc pero tienen q reconocer que est√°n dejando sin empleo a un Colombiano en un pa√≠s donde el desempleo estaba en 13% ahora 23% gracias a la migraci√≥n ahora la ,-0.5,1,0,0
1594,1.38E+18,4/19/2021,20:39:13,so_disorder,Maureen con doble E,"Digamos que medio colabore en una investigaci√≥n sobre migraci√≥n en Chile, desde la mirada o perspectivas de Organizaciones migrantes o asociaciones pro-migrantes y de verdad, en serio, entendamos por favor, que la migraci√≥n en Latinoam√©rica no se resume a la venezolana.",0,0,1,0
1595,1.38E+18,4/19/2021,19:40:11,saime_lara,Larasaime,"@MMHT0110 Debes hacer un dep√≥sito de 0.5 petros, en banco de Venezuela a las cuentas de saime, luego vas a la oficina de migraci√≥n en el aeropuerto con tu pasaporte y te actualizan el movimiento migratorio",0,1,1,0
1596,1.38E+18,4/19/2021,19:19:04,juanrbeaumontp,Juan Beaumont P,"@LassoGuillermo presidente spy periodista en Venezuela, me gustaria ver la posibilidad de un vocero para hablar de la migraci√≥n venezolana en su pa√≠s. Agradecido",0,0,0,0
1597,1.38E+18,4/19/2021,19:07:39,jaimeccs,Jaime CCS #VotemosParaBotarlos,"¬ø Qui√©n promovi√≥ la migraci√≥n masiva de colombianos hasta guerrilleros a Venezuela para usarlos como paramilitares?  R= Hugo Ch√°vez  ¬ø Qui√©n gener√≥ escasez de agua, medicamentos, alimentos y hasta gasolina para medir y controlar al pueblo?  R= Hugo Ch√°vez",-0.5,1,87,263
1598,1.38E+18,4/19/2021,18:05:49,lianvdf,Lian De Gouveia,1- Miseria. 2- Hambre. 3- Crisis Sanitaria. 4- Migraci√≥n forzada. 5- Persecuci√≥n pol√≠tica.  5 caracter√≠sticas. 1 modelo: comunismo. 2 ejemplos: Cuba y Venezuela.,-0.5,0,1,4
1599,1.38E+18,4/19/2021,17:52:40,emiliolugodp,Emilio Lugo,@lrangel25 Ya no tienen pais que gobernar s√≥lo gobiernan escombros y cenizas la poca democracia que quedaba se termin√≥ y es mejor que te fijes como la migraci√≥n venezolana ha ayudado a subir el PIB de otros pa√≠ses por ejemplo Peru y ecuador,-0.25,0,0,1
1600,1.38E+18,4/19/2021,16:28:51,nic0ntent0,Nicol√°s,"Los peruanos est√°n viviendo de primera mano los efectos de la migraci√≥n forzada, culpa de las pol√≠ticas de la narc* dict*dura Venezolana, y a√∫n as√≠ piensan votar por un tipo que quiere aplicar AL CALCO esas pol√≠ticas en su pa√≠s   ¬øSon pendejos o que?",0,1,2,6
1601,1.38E+18,4/19/2021,16:25:08,luiscfotografia,Fotograforeinventado,"@federicorios Ahi las razones de la migraci√≥n venezolana. Silicon Valley, huevos baratos y panaderias pagando $ 2,000,000",0.25,0,0,1
1602,1.38E+18,4/19/2021,16:14:29,luiscfotografia,Fotograforeinventado,"Ya entiendo por que tanto venezolano en Colombia. Docena de huevos a $ 1,800 y el salario minino escandalosamente alto. Esperemos hasta migraci√≥n de Estados Unidos",0,0,0,0
1603,1.38E+18,4/19/2021,15:33:21,pinllocoto,Marco Fern√°ndez,@Gladiador2111 No puedes justificar unos por otros. Pandillas y desadaptados los hay en todos lados. Por regla general pregunta en Espa√±a la opini√≥n de los ecuatorianos y en general es muy positiva. La migraci√≥n venezolana es controlada a prop√≥sito pa,0.25,0,0,0
1604,1.38E+18,4/19/2021,15:21:18,_reddenoticias,Red de Noticias,"üáªüá™#Nacional | Ni√±os se quedan sin padres y abuelas vuelven a ser madres  producto de la imparable migraci√≥n venezolana, dice Sebastiana Barr√°ez. #19abril",0,0,0,0
1605,1.38E+18,4/19/2021,14:29:08,castellano_jl,Jose Luis,"@PanchoArias2012 PANCHO QUE TAL LA INFLACION DE VENEZUELA, EL PIB, LA MIGRACION VENEZOLANA, LOS SERVICIOS BASICOS como los vez hoy en dia??",-0.25,0,0,0
1606,1.38E+18,4/19/2021,14:19:20,p_adro,Adro P J,"@OjedaJro @merv59 Hombre, ya empez√≥ a lanzar su vergonzosa""argumentaci√≥n"" de mierda, y si hablamos de migraci√≥n, creo que un venezolano no est√° en condiciones de levantar cabeza por ello. Y hemos visto tambi√©n la salvajadas que ha hecho la GNV contra",-0.5,0,0,0
1607,1.38E+18,4/19/2021,14:02:08,vento_g,Oscar Vento G.,@CorvoMecanique Migraci√≥n venezolana a Per√∫ empez√≥ el 2014.,0,3,0,0
1608,1.38E+18,4/19/2021,13:52:07,r3m_xx,3üÜÅüÑº,"@EnterateCali Soy venezolano y reconozco que el √∫ltimo oleaje de Migraci√≥n ha llegado mucha escoria, gente de mal vivir. Pero no todos somos as√≠. Y no debe excusar su mala gesti√≥n culpando a un leve porcentaje de personas. Aqu√≠ hay guerra de narcos, ",-0.25,1,0,0
1609,1.38E+18,4/19/2021,12:30:11,chicalaura_ven,laura garc√≠a,"Si el gobierno nos dijera la verdad, ejemplo: Nuestra econom√≠a necesita como 50 a√±os mas para que se pueda estabilizar, pero no la dice porque una noticia como esta podr√≠a incitar a la migraci√≥n y es peligrosa porque puede generar mas depresi√≥n en el venezolano...",-0.5,0,0,0
1610,1.38E+18,4/19/2021,12:29:47,laurascantor,Sof√≠a,"2. La primera noche visitando la Torre del Reloj; las mujeres acomodadas en un c√≠rculo, b√°sicamente como un mercado de mujeres, sin protecci√≥n, sin tapabocas, muchaaas mujeres, muchas.  Suma entre migraci√≥n venezolana y crisis por pandemia: Explotaci√≥n sexual y miseria.",0,1,0,0
1611,1.38E+18,4/19/2021,12:20:54,isabelviales,Isabel Vial,"#Migracion ¬øC√≥mo obtener la nacionalidad chilena, siendo hijo de padre chileno, fallecido en Venezuela? ¬øCu√°les documentos son  necesarios para iniciar el proceso estando en Chile?",0,0,1,0
1612,1.38E+18,4/19/2021,11:55:41,beeckxs,B,Me llamaron para hacerme una encuesta sobre la migraci√≥n venezolana y sus repercusiones en la sociedad (?,0,0,0,0
1613,1.38E+18,4/19/2021,11:29:49,calincajamarca,üáµüá™ùóñùóÆùóπ√≠ùóª ùóöùóºùóªùòáùóÆùóπùó≤ùòÄüè≥Ô∏è‚Äçüåà,"En Venezuela el botin es el petr√≥leo y todo esta encaminado para ello, generaron una dictadura y una migraci√≥n masiva para tener la excusa perfecta, en el fondo potencias pele√°ndose el acceso al petr√≥leo, no hay m√°s!",-0.25,2,1,9
1614,1.38E+18,4/19/2021,11:20:12,solanm815,Maurovix üá®üá¥..Unidos por Colombia‚úäüá®üá¥,"@andres83861926 @SoyAliciaFranco @juliab128 Aqui no se trata de partidos, pero sabes ojala ganara la izquierda en colombia y verias que el primer a√±o seria genial mientras se acaban los recursos porque depues si muchos colombianos han salido van a ver un",0,2,0,0
1615,1.38E+18,4/19/2021,11:17:07,jhormancruz1,Jhorman Cruz,"üö∂‚Äç‚ôÄ Ni√±os se quedan sin padres y abuelas vuelven a ser madres  producto de la imparable migraci√≥n venezolana, dice Sebastiana Barr√°ez.",-0.5,1,1,0
1616,1.38E+18,4/19/2021,9:56:16,alvaro_robledo,Alvaro Robledo,"#estardesconectadoes en este tiempo de reformas,desconocer que parte del hueco fiscal se debe a la migraci√≥n venezolana y hay tener en cuenta que la ayuda internacional puede servir para tapar ese hueco",-0.25,0,0,0
1617,1.38E+18,4/19/2021,9:53:46,noticiasbta,NoticiasBta,"El director de migraci√≥n colombiana, indic√≥ que, de acuerdo con la caracterizaci√≥n realizada, en el municipio de Arauquita permanecen un poco m√°s de 4 mil personas de nacionalidad venezolana, cerca de 1.300 colombianas y un poco m√°s de 400, que ostentan doble nacionalidad",0,1,0,0
1618,1.38E+18,4/19/2021,9:42:07,guidoagr,Guido A. Gnzlz Rdrgz,@JRobertoDuque ... y adem√°s la migraci√≥n masiva era de colombianos a Venezuela escapando de la violencia y la pobreza.,0,0,0,0
1619,1.38E+18,4/19/2021,9:14:22,claritohablando,Hablando Clarito üá™üá®,"@CNNEE Pobre pa√≠s Venezuela,  Es incre√≠ble c√≥mo lo siguen destruyendo. Algo deben hacer es indignante todo lo que se ve .. de verdad ya no tienen verg√ºenza.  Lo peor es que el resto de la regi√≥n tambi√©n paga esos problemas con la migraci√≥n desmedid",-1,0,0,2
1620,1.38E+18,4/19/2021,9:04:52,kaosjimenez,se√±orX,@obregi @carlswalls @miraryopinar @Esteban33494012 @ELTIEMPO Que man tan ignorante luego es q en Venezuela no expropiaron todos esos noticieros es que Venezuela no tiene ni ONU   Vea lo q gener√≥ el socialismo en Latinoam√©rica miseria para los latinos y ,-0.75,1,0,0
1621,1.38E+18,4/19/2021,9:02:14,ernesto11089715,ERNESTO,"@dorissoliz Una derecha que repet√≠a a diario que si votaban por la izquierda, nos convertiriamos en Venezuela, jajajaja.... todav√≠a no toma el poder y ya empieza la migraci√≥n.... Que pena mi Pa√≠s......como dice la publicaci√≥n del banquero...... LO PE",-0.5,0,0,0
1622,1.38E+18,4/19/2021,8:41:14,devastadoriv,angelo gallard,"@jguaido El d√≠a que lleguen las elecciones libres en Venezuela, no quedara gente para votar, por la alta migraci√≥n de venezolanos, pero si ese es su lema o norte, seguir√° perdiendo el tiempo.",-0.25,0,0,0
1623,1.38E+18,4/19/2021,7:01:52,marielitux,Mariel Adarmes,"Tengo la leve sospecha que me estoy animando otra vez con el #Softwarelibre, es que esto de la migraci√≥n venezolana te desconecta, ya estoy conectado con @flisol_bogota. Tarea pedirle los correos a mi coordinador de los estudiantes de ingenier√≠a para que asistamos virtual",-0.25,0,0,0
